{
  "benchmarkVersion": "2.0.0",
  "targets": [
    {
      "id": "public-vibe-coding-vulnerable",
      "control": "controlled",
      "layer": "public",
      "revision": "sha256:800a5c5a263865593afba9196ee2ecdb050f6b4196e8979287b9e71908427365"
    },
    {
      "id": "public-vibe-coding-partially-fixed",
      "control": "controlled",
      "layer": "public",
      "revision": "sha256:5faed2fc792cf426f2652b6ddc21cb6b7648b0ee0ff5471b0e84debd2e7277e0"
    },
    {
      "id": "public-vibe-coding-fixed",
      "control": "controlled",
      "layer": "public",
      "revision": "sha256:34724c3ab5fea7d136a45bc66e486d4806e639efaa7f5d432479778dc83af9ab"
    },
    {
      "id": "public-vibe-coding-reintroduced",
      "control": "controlled",
      "layer": "public",
      "revision": "sha256:669fbf3c1dc8a84eb1b4c8863015969f802aeb0ad1355bceb1c9873526fe98c8"
    }
  ],
  "cases": [
    {
      "id": "public-nextjs-vulnerable",
      "targetId": "public-vibe-coding-vulnerable",
      "targetRevision": "sha256:800a5c5a263865593afba9196ee2ecdb050f6b4196e8979287b9e71908427365",
      "state": "vulnerable",
      "scanner": "public-scan",
      "capability": "technology-identification",
      "ruleFamily": "nextjs-technology",
      "expectedPresence": true,
      "expectedSeverity": "info",
      "groupingKey": "technology-nextjs",
      "safeEvidence": "The controlled response exposes matching Next.js HTTP and DOM signals.",
      "fixedCaseId": "public-nextjs-fixed",
      "functionalAssertion": "GET / returns HTTP 200 and matching Next.js HTTP and DOM markers.",
      "scannerProfile": "public-passive@3",
      "rulesetDigest": "sha256:3bc3f542f456190db2bc8d11cc3b458019ac0ed44340d7a092c97878accfcb24"
    },
    {
      "id": "public-vercel-vulnerable",
      "targetId": "public-vibe-coding-vulnerable",
      "targetRevision": "sha256:800a5c5a263865593afba9196ee2ecdb050f6b4196e8979287b9e71908427365",
      "state": "vulnerable",
      "scanner": "public-scan",
      "capability": "hosting-identification",
      "ruleFamily": "vercel-host-profile",
      "expectedPresence": true,
      "expectedSeverity": "info",
      "groupingKey": "hosting-vercel",
      "safeEvidence": "The controlled response declares the Vercel host profile in HTTP and DOM metadata.",
      "fixedCaseId": "public-vercel-fixed",
      "functionalAssertion": "GET / returns HTTP 200 and matching Vercel profile markers without deployment access.",
      "scannerProfile": "public-passive@3",
      "rulesetDigest": "sha256:3bc3f542f456190db2bc8d11cc3b458019ac0ed44340d7a092c97878accfcb24"
    },
    {
      "id": "public-lovable-vulnerable",
      "targetId": "public-vibe-coding-vulnerable",
      "targetRevision": "sha256:800a5c5a263865593afba9196ee2ecdb050f6b4196e8979287b9e71908427365",
      "state": "vulnerable",
      "scanner": "public-scan",
      "capability": "technology-identification",
      "ruleFamily": "lovable-generator",
      "expectedPresence": true,
      "expectedSeverity": "info",
      "groupingKey": "technology-lovable",
      "safeEvidence": "The controlled DOM contains the declared Lovable generator marker.",
      "fixedCaseId": "public-lovable-fixed",
      "functionalAssertion": "GET / returns HTTP 200 and a deterministic generator meta element.",
      "scannerProfile": "public-passive@3",
      "rulesetDigest": "sha256:3bc3f542f456190db2bc8d11cc3b458019ac0ed44340d7a092c97878accfcb24"
    },
    {
      "id": "public-supabase-client-vulnerable",
      "targetId": "public-vibe-coding-vulnerable",
      "targetRevision": "sha256:800a5c5a263865593afba9196ee2ecdb050f6b4196e8979287b9e71908427365",
      "state": "vulnerable",
      "scanner": "public-scan",
      "capability": "technology-identification",
      "ruleFamily": "supabase-client",
      "expectedPresence": true,
      "expectedSeverity": "info",
      "groupingKey": "technology-supabase",
      "safeEvidence": "The DOM and public resource declare a network-disabled Supabase client.",
      "fixedCaseId": "public-supabase-client-fixed",
      "functionalAssertion": "The Supabase fixture disables persistence and network access while its single public script returns HTTP 200.",
      "scannerProfile": "public-passive@3",
      "rulesetDigest": "sha256:3bc3f542f456190db2bc8d11cc3b458019ac0ed44340d7a092c97878accfcb24"
    },
    {
      "id": "public-supabase-public-keys-vulnerable",
      "targetId": "public-vibe-coding-vulnerable",
      "targetRevision": "sha256:800a5c5a263865593afba9196ee2ecdb050f6b4196e8979287b9e71908427365",
      "state": "vulnerable",
      "scanner": "public-scan",
      "capability": "public-secret-classification",
      "ruleFamily": "supabase-public-keys",
      "expectedPresence": false,
      "expectedSeverity": null,
      "groupingKey": null,
      "safeEvidence": "Explicitly synthetic Supabase publishable and anon values remain public non-secret configuration.",
      "fixedCaseId": "public-supabase-public-keys-fixed",
      "functionalAssertion": "The public resource exposes only non-functional publishable and anon values and performs no Supabase request.",
      "scannerProfile": "public-passive@3",
      "rulesetDigest": "sha256:3bc3f542f456190db2bc8d11cc3b458019ac0ed44340d7a092c97878accfcb24"
    },
    {
      "id": "public-header-vulnerable",
      "targetId": "public-vibe-coding-vulnerable",
      "targetRevision": "sha256:800a5c5a263865593afba9196ee2ecdb050f6b4196e8979287b9e71908427365",
      "state": "vulnerable",
      "scanner": "public-scan",
      "capability": "public-header-analysis",
      "ruleFamily": "missing-content-security-policy",
      "expectedPresence": true,
      "expectedSeverity": "low",
      "groupingKey": "security-header",
      "safeEvidence": "The controlled root response omits Content-Security-Policy.",
      "fixedCaseId": "public-header-fixed",
      "functionalAssertion": "GET / returns HTTP 200 independently of the security-header state.",
      "scannerProfile": "public-passive@3",
      "rulesetDigest": "sha256:3bc3f542f456190db2bc8d11cc3b458019ac0ed44340d7a092c97878accfcb24"
    },
    {
      "id": "public-cookie-vulnerable",
      "targetId": "public-vibe-coding-vulnerable",
      "targetRevision": "sha256:800a5c5a263865593afba9196ee2ecdb050f6b4196e8979287b9e71908427365",
      "state": "vulnerable",
      "scanner": "public-scan",
      "capability": "public-cookie-analysis",
      "ruleFamily": "insecure-cookie-attributes",
      "expectedPresence": true,
      "expectedSeverity": "medium",
      "groupingKey": "cookie-attributes",
      "safeEvidence": "The synthetic response cookie omits Secure, HttpOnly and SameSite.",
      "fixedCaseId": "public-cookie-fixed",
      "functionalAssertion": "The cookie contains only a fixed synthetic value and stores no visitor data.",
      "scannerProfile": "public-passive@3",
      "rulesetDigest": "sha256:3bc3f542f456190db2bc8d11cc3b458019ac0ed44340d7a092c97878accfcb24"
    },
    {
      "id": "public-form-vulnerable",
      "targetId": "public-vibe-coding-vulnerable",
      "targetRevision": "sha256:800a5c5a263865593afba9196ee2ecdb050f6b4196e8979287b9e71908427365",
      "state": "vulnerable",
      "scanner": "public-scan",
      "capability": "public-form-analysis",
      "ruleFamily": "password-form-uses-get",
      "expectedPresence": true,
      "expectedSeverity": "medium",
      "groupingKey": "form-transport",
      "safeEvidence": "The inert password-form fixture declares the GET method.",
      "fixedCaseId": "public-form-fixed",
      "functionalAssertion": "All form controls are inert and every mutation method returns HTTP 405 without reading a body.",
      "scannerProfile": "public-passive@3",
      "rulesetDigest": "sha256:3bc3f542f456190db2bc8d11cc3b458019ac0ed44340d7a092c97878accfcb24"
    },
    {
      "id": "public-mixed-content-vulnerable",
      "targetId": "public-vibe-coding-vulnerable",
      "targetRevision": "sha256:800a5c5a263865593afba9196ee2ecdb050f6b4196e8979287b9e71908427365",
      "state": "vulnerable",
      "scanner": "public-scan",
      "capability": "public-resource-analysis",
      "ruleFamily": "mixed-content",
      "expectedPresence": true,
      "expectedSeverity": "medium",
      "groupingKey": "mixed-content",
      "safeEvidence": "The controlled DOM references an HTTP resource below the reserved invalid domain.",
      "fixedCaseId": "public-mixed-content-fixed",
      "functionalAssertion": "GET / remains functional and the mixed-content hostname cannot resolve externally.",
      "scannerProfile": "public-passive@3",
      "rulesetDigest": "sha256:3bc3f542f456190db2bc8d11cc3b458019ac0ed44340d7a092c97878accfcb24"
    },
    {
      "id": "public-secret-vulnerable",
      "targetId": "public-vibe-coding-vulnerable",
      "targetRevision": "sha256:800a5c5a263865593afba9196ee2ecdb050f6b4196e8979287b9e71908427365",
      "state": "vulnerable",
      "scanner": "public-scan",
      "capability": "synthetic-secret-detection",
      "ruleFamily": "synthetic-elevated-secret",
      "expectedPresence": true,
      "expectedSeverity": "high",
      "groupingKey": "synthetic-secret-marker",
      "safeEvidence": "The public resource contains a documented non-functional Rappor elevated marker.",
      "fixedCaseId": "public-secret-fixed",
      "functionalAssertion": "The single public script returns deterministic JavaScript without a functioning credential.",
      "scannerProfile": "public-passive@3",
      "rulesetDigest": "sha256:3bc3f542f456190db2bc8d11cc3b458019ac0ed44340d7a092c97878accfcb24"
    },
    {
      "id": "public-nextjs-partially-fixed",
      "targetId": "public-vibe-coding-partially-fixed",
      "targetRevision": "sha256:5faed2fc792cf426f2652b6ddc21cb6b7648b0ee0ff5471b0e84debd2e7277e0",
      "state": "partially-fixed",
      "scanner": "public-scan",
      "capability": "technology-identification",
      "ruleFamily": "nextjs-technology",
      "expectedPresence": true,